sistema,ano,dimensao_id_original,dimensao_padrao,subdimensao,questao,elemento,nivel,tipo_elemento,texto_completo,pontuacao_maxima_dimensao,pontuacao_maxima_capacidade_chave,nome_variavel,numero_questao,respuesta,pontuacao_maxima_questao,pontuacao_item
chile,2025,I,recursos_institucionais,Talento humano,"Durante o período analisado, quantas pessoas trabalharam na instituição?","Durante o período analisado, quantas pessoas trabalharam na instituição?",4,Questão,"Talento humano Durante o período analisado, quantas pessoas trabalharam na instituição? Durante o período analisado, quantas pessoas trabalharam na instituição?",20,6.0,Multidiciplina,1A,Respuesta numérica. Levantamiento administrativo.,1,0
chile,2025,I,recursos_institucionais,Talento humano,"Durante o período analisado, quantos programas de formação ou profissões diferentes estavam presentes na instituição?","Durante o período analisado, quantos programas de formação ou profissões diferentes estavam presentes na instituição?",4,Questão,"Talento humano Durante o período analisado, quantos programas de formação ou profissões diferentes estavam presentes na instituição? Durante o período analisado, quantos programas de formação ou profissões diferentes estavam presentes na instituição?",20,6.0,Multidiciplina,1,A. Entre 1 y 10 B. Entre 11 y 20 C. Entre 21 y 30 D. Entre 31 y 40 D. Entre 31 y 40 E. Entre 41 y 50 F. Entre 51 y 60 G. Entre 61 y 70 H. Entre 71 y 80 I. Entre 81 y 90 J. Más de 90,1,0.4; 0.4; 0.6; 0.6; 0.6; 0.8; 0.8; 0.8; 1; 1
chile,2025,I,recursos_institucionais,Talento humano,"Durante o período analisado, a instituição contava com pessoas dedicadas principalmente a funções relacionadas à inovação pública, como design de serviços, experiência do usuário, ciência comportamental ou gestão de mudanças?","Durante o período analisado, a instituição contava com pessoas dedicadas principalmente a funções relacionadas à inovação pública, como design de serviços, experiência do usuário, ciência comportamental ou gestão de mudanças?",4,Questão,"Talento humano Durante o período analisado, a instituição contava com pessoas dedicadas principalmente a funções relacionadas à inovação pública, como design de serviços, experiência do usuário, ciência comportamental ou gestão de mudanças? Durante o período analisado, a instituição contava com pessoas dedicadas principalmente a funções relacionadas à inovação pública, como design de serviços, experiência do usuário, ciência comportamental ou gestão de mudanças?",20,6.0,Multidiciplina,2,Resposta única. A. Sim; B. Não (Ir para a questão 3),1,1
chile,2025,I,recursos_institucionais,Talento humano,"Quantas pessoas em sua instituição estavam envolvidas principalmente em funções relacionadas à inovação pública, como design de serviços, experiência do usuário, ciência comportamental ou gestão de mudanças?","Quantas pessoas em sua instituição estavam envolvidas principalmente em funções relacionadas à inovação pública, como design de serviços, experiência do usuário, ciência comportamental ou gestão de mudanças?",4,Questão,"Talento humano Quantas pessoas em sua instituição estavam envolvidas principalmente em funções relacionadas à inovação pública, como design de serviços, experiência do usuário, ciência comportamental ou gestão de mudanças? Quantas pessoas em sua instituição estavam envolvidas principalmente em funções relacionadas à inovação pública, como design de serviços, experiência do usuário, ciência comportamental ou gestão de mudanças?",20,6.0,Multidiciplina,2.1,Si contestó que sí en la pregunta anterior. Respuesta numérica.,1,1
chile,2025,I,recursos_institucionais,Talento humano,"Das pessoas declaradas na questão 2.1, quantas são mulheres?","Das pessoas declaradas na questão 2.1, quantas são mulheres?",4,Questão,"Talento humano Das pessoas declaradas na questão 2.1, quantas são mulheres? Das pessoas declaradas na questão 2.1, quantas são mulheres?",20,6.0,Multidiciplina,2.2,Si contestó que sí en la pregunta 2. Respuesta numérica,0,0
chile,2025,I,recursos_institucionais,Talento humano,"Das pessoas declaradas na questão 2.1, quantas são homens?","Das pessoas declaradas na questão 2.1, quantas são homens?",4,Questão,"Talento humano Das pessoas declaradas na questão 2.1, quantas são homens? Das pessoas declaradas na questão 2.1, quantas são homens?",20,6.0,Multidiciplina,2.3,Si contestó que sí en la pregunta 2. Respuesta numérica,0,0
chile,2025,I,recursos_institucionais,Talento humano,"Durante o período analisado, foram realizadas sessões de treinamento relacionadas à inovação para os funcionários da instituição?","Durante o período analisado, foram realizadas sessões de treinamento relacionadas à inovação para os funcionários da instituição?",4,Questão,"Talento humano Durante o período analisado, foram realizadas sessões de treinamento relacionadas à inovação para os funcionários da instituição? Durante o período analisado, foram realizadas sessões de treinamento relacionadas à inovação para os funcionários da instituição?",20,6.0,Capacitação em inovação,3,Resposta única. A. Sim; B. Não (Ir para a questão 4),0,0
chile,2025,I,recursos_institucionais,Talento humano,"Durante o período analisado, quantas pessoas receberam treinamento em temas relacionados à inovação?","Durante o período analisado, quantas pessoas receberam treinamento em temas relacionados à inovação?",4,Questão,"Talento humano Durante o período analisado, quantas pessoas receberam treinamento em temas relacionados à inovação? Durante o período analisado, quantas pessoas receberam treinamento em temas relacionados à inovação?",20,6.0,Capacitação em inovação,3.1,Si contestó que sí en la pregunta anterior.,1,1
chile,2025,I,recursos_institucionais,Talento humano,Que mecanismos de apoio ou promoção da formação em inovação a instituição implementou durante o período mencionado?,Que mecanismos de apoio ou promoção da formação em inovação a instituição implementou durante o período mencionado?,4,Questão,Talento humano Que mecanismos de apoio ou promoção da formação em inovação a instituição implementou durante o período mencionado? Que mecanismos de apoio ou promoção da formação em inovação a instituição implementou durante o período mencionado?,20,6.0,Capacitação em inovação,3.2,"Se você respondeu sim à pergunta 3, selecione uma única resposta: A. Financiamento para treinamento. B. Alocação de horas de trabalho. C. Horário de trabalho flexível. D. Financiamento, horário de trabalho flexível e alocação de horas de trabalho para treinamento.",0.5,0.3; 0.3; 0.2; 05
chile,2025,I,recursos_institucionais,Talento humano,Qual foi o orçamento total para treinamento executado pela instituição durante o ano de 2024?,Qual foi o orçamento total para treinamento executado pela instituição durante o ano de 2024?,4,Questão,Talento humano Qual foi o orçamento total para treinamento executado pela instituição durante o ano de 2024? Qual foi o orçamento total para treinamento executado pela instituição durante o ano de 2024?,20,6.0,Capacitação em inovação,3.3,Resposta númerica,0,
chile,2025,I,recursos_institucionais,Talento humano,"Do orçamento executado em capacitações durante 2024, quanto correspondeu a capacitações em inovação?","Do orçamento executado em capacitações durante 2024, quanto correspondeu a capacitações em inovação?",4,Questão,"Talento humano Do orçamento executado em capacitações durante 2024, quanto correspondeu a capacitações em inovação? Do orçamento executado em capacitações durante 2024, quanto correspondeu a capacitações em inovação?",20,6.0,Capacitação em inovação,3.4,Se respondeu que sim a pergunta 3. Respuesta numérica.,1,
chile,2025,I,recursos_institucionais,Talento humano,O Plano Anual de Capacitação 2025 da instituição inclui capacitações em inovação?,O Plano Anual de Capacitação 2025 da instituição inclui capacitações em inovação?,4,Questão,Talento humano O Plano Anual de Capacitação 2025 da instituição inclui capacitações em inovação? O Plano Anual de Capacitação 2025 da instituição inclui capacitações em inovação?,20,6.0,Capacitação em inovação,4,Resposta única. A. Sim; B. Não,05; 0,
chile,2025,I,recursos_institucionais,Talento humano,"Em relação ao último Plano Anual de Capacitação, de onde surgiram principalmente os assuntos que exigiam capacitação? Marque todas as opções correspondentes.","Em relação ao último Plano Anual de Capacitação, de onde surgiram principalmente os assuntos que exigiam capacitação? Marque todas as opções correspondentes.",4,Questão,"Talento humano Em relação ao último Plano Anual de Capacitação, de onde surgiram principalmente os assuntos que exigiam capacitação? Marque todas as opções correspondentes. Em relação ao último Plano Anual de Capacitação, de onde surgiram principalmente os assuntos que exigiam capacitação? Marque todas as opções correspondentes.",20,6.0,Capacitação em inovação,4.1,,,
chile,2025,I,recursos_institucionais,Marco Institucional,"Durante o período medido, existiram na instituição instâncias de trabalho colaborativo sistemático entre duas ou mais áreas funcionais para o desenvolvimento da inovação?","Durante o período medido, existiram na instituição instâncias de trabalho colaborativo sistemático entre duas ou mais áreas funcionais para o desenvolvimento da inovação?",4,Questão,"Marco Institucional Durante o período medido, existiram na instituição instâncias de trabalho colaborativo sistemático entre duas ou mais áreas funcionais para o desenvolvimento da inovação? Durante o período medido, existiram na instituição instâncias de trabalho colaborativo sistemático entre duas ou mais áreas funcionais para o desenvolvimento da inovação?",20,2.0,Redes internas de colaboração,5,Resposta única. A. Sim; B. Não (Ir para a questão 6),0,
chile,2025,I,recursos_institucionais,Marco Institucional,Quais eram os objetivos dessas instâncias de colaboração interna? Marque todas as opções correspondentes.,Quais eram os objetivos dessas instâncias de colaboração interna? Marque todas as opções correspondentes.,4,Questão,Marco Institucional Quais eram os objetivos dessas instâncias de colaboração interna? Marque todas as opções correspondentes. Quais eram os objetivos dessas instâncias de colaboração interna? Marque todas as opções correspondentes.,20,2.0,Redes internas de colaboração,5.1,"Marque todas las que correspondan.
A. Desarrollo de iniciativas de innovación.
B. Gestión de la innovación institucional.
C. Cultura y Gestión del cambio.
D. Otro(s) ¿Cuál(es)?",0.75,
chile,2025,I,recursos_institucionais,Marco Institucional,"Durante o período medido, a instituição utilizou plataformas que permitiam o trabalho colaborativo on-line?","Durante o período medido, a instituição utilizou plataformas que permitiam o trabalho colaborativo on-line?",4,Questão,"Marco Institucional Durante o período medido, a instituição utilizou plataformas que permitiam o trabalho colaborativo on-line? Durante o período medido, a instituição utilizou plataformas que permitiam o trabalho colaborativo on-line?",20,2.0,Redes internas de colaboração,6,Resposta única. A. Sim; B. Não (Ir para a questão 7),0.1,sim: 0.1; não 0
chile,2025,I,recursos_institucionais,Marco Institucional,Selecione as plataformas que a instituição utilizou com maior frequência para o trabalho colaborativo. Marque todas as opções correspondentes.,Selecione as plataformas que a instituição utilizou com maior frequência para o trabalho colaborativo. Marque todas as opções correspondentes.,4,Questão,Marco Institucional Selecione as plataformas que a instituição utilizou com maior frequência para o trabalho colaborativo. Marque todas as opções correspondentes. Selecione as plataformas que a instituição utilizou com maior frequência para o trabalho colaborativo. Marque todas as opções correspondentes.,20,2.0,Redes internas de colaboração,6.1,"Marque todas las que correspondan.
A. Teams.
B. Dropbox.
C. Google Docs.
D. Mural o Miró.
E. Onedrive.
F. Otra(s) ¿Cuál(es)?",0,0
chile,2025,I,recursos_institucionais,Marco Institucional,"Durante o período medido, quais dos seguintes mecanismos ou ações institucionais sua instituição utilizou para promover a inovação entre suas funcionárias e funcionários?","Durante o período medido, quais dos seguintes mecanismos ou ações institucionais sua instituição utilizou para promover a inovação entre suas funcionárias e funcionários?",4,Questão,"Marco Institucional Durante o período medido, quais dos seguintes mecanismos ou ações institucionais sua instituição utilizou para promover a inovação entre suas funcionárias e funcionários? Durante o período medido, quais dos seguintes mecanismos ou ações institucionais sua instituição utilizou para promover a inovação entre suas funcionárias e funcionários?",20,2.0,Promoção da Inovação,7,"Marque todas as opções correspondentes. A. Prêmios ou reconhecimentos a equipes ou pessoas por iniciativas inovadoras. B. Fundos ou orçamentos internos para desenvolver iniciativas de inovação. C. Chamadas internas abertas para participar de projetos de inovação. D. Canais institucionais para compartilhar aprendizados ou experiências de inovação (intranet, boletins, jornadas etc.). E. Espaços ou metodologias participativas para propor melhorias ou soluções (ex.: caixa de ideias, laboratórios, oficinas). F. Instancias formais de colaboração internas orientadas a inovação (mesas, comites, redes internas). G. Outros? Quais? H. Não utiliza ações institucionais desse tipo.",0,
chile,2025,I,recursos_institucionais,Marco Institucional,"Durante o período medido, a instituição publicou dados abertos?","Durante o período medido, a instituição publicou dados abertos?",4,Questão,"Marco Institucional Durante o período medido, a instituição publicou dados abertos? Durante o período medido, a instituição publicou dados abertos?",20,2.0,Dados abertos,8,Resposta única. A. Sim; B. Não (Ir para a questão 9),0,
chile,2025,I,recursos_institucionais,Marco Institucional,Essas publicações de dados abertos foram realizadas em portal próprio ou no dados.gob.cl?,Essas publicações de dados abertos foram realizadas em portal próprio ou no dados.gob.cl?,4,Questão,Marco Institucional Essas publicações de dados abertos foram realizadas em portal próprio ou no dados.gob.cl? Essas publicações de dados abertos foram realizadas em portal próprio ou no dados.gob.cl?,20,2.0,Dados abertos,8.1,Marque todas as opções correspondentes. A. Em portal próprio. B. Em datos.gob.cl,0.4,02;02
chile,2025,I,recursos_institucionais,Marco Institucional,Em quais formatos esses dados abertos foram publicados?,Em quais formatos esses dados abertos foram publicados?,4,Questão,Marco Institucional Em quais formatos esses dados abertos foram publicados? Em quais formatos esses dados abertos foram publicados?,20,2.0,Dados abertos,8.2,"Se respondeu que sim a pergunta 8. A. Formato de lectura (XML, PDF, HTML).
B. Formato bases de datos procesables (CSV, JSON, DTA, otros).
C. Formato multimedia (videos, imágenes, sonidos).
D. Otro(s) ¿Cu",0.4,0.1; 0.2; 0.1; 0
chile,2025,I,recursos_institucionais,Marco Institucional,"Durante o período medido, existiu na instituição uma área responsável pela gestão de dados abertos?","Durante o período medido, existiu na instituição uma área responsável pela gestão de dados abertos?",4,Questão,"Marco Institucional Durante o período medido, existiu na instituição uma área responsável pela gestão de dados abertos? Durante o período medido, existiu na instituição uma área responsável pela gestão de dados abertos?",20,2.0,Dados abertos,8.3,"Se respondeu que sim a pergunta 8. puesta única.
A. Sí, su función incluía identificar datos e información para mejorar la
eficiencia y la toma de decisiones estratégicas de la entidad.
B. Sí, pero su función sólo consideraba la publicación de datos en formato
abiertos y/o transparencia.
C. No",0.2,
chile,2025,I,recursos_institucionais,Marco Institucional,"Durante o período medido, a instituição realizou ações para se comunicar e receber feedback das pessoas ou organizações que utilizaram seus dados abertos?","Durante o período medido, a instituição realizou ações para se comunicar e receber feedback das pessoas ou organizações que utilizaram seus dados abertos?",4,Questão,"Marco Institucional Durante o período medido, a instituição realizou ações para se comunicar e receber feedback das pessoas ou organizações que utilizaram seus dados abertos? Durante o período medido, a instituição realizou ações para se comunicar e receber feedback das pessoas ou organizações que utilizaram seus dados abertos?",20,2.0,Dados abertos,8.4,Se respondeu que sim a pergunta 8. A. Sim; B. Não,0.15,sim: 0.15; não 0
chile,2025,I,recursos_institucionais,Recursos Digitais,"Durante o período medido, a instituição trabalhava com pelo menos uma tecnologia “Open Source” ou “Código Aberto”?","Durante o período medido, a instituição trabalhava com pelo menos uma tecnologia “Open Source” ou “Código Aberto”?",4,Questão,"Recursos Digitais Durante o período medido, a instituição trabalhava com pelo menos uma tecnologia “Open Source” ou “Código Aberto”? Durante o período medido, a instituição trabalhava com pelo menos uma tecnologia “Open Source” ou “Código Aberto”?",20,4.0,TIC´S,9,Resposta única. A. Sim; B. Não,0.65,sim: 0.65; não 0
chile,2025,I,recursos_institucionais,Recursos Digitais,"Durante o período medido, a instituição tinha ClaveÚnica como mecanismo de autenticação utilizado pelas pessoas para acessar serviços em quaisquer de seus meios ou canais de atendimento?","Durante o período medido, a instituição tinha ClaveÚnica como mecanismo de autenticação utilizado pelas pessoas para acessar serviços em quaisquer de seus meios ou canais de atendimento?",4,Questão,"Recursos Digitais Durante o período medido, a instituição tinha ClaveÚnica como mecanismo de autenticação utilizado pelas pessoas para acessar serviços em quaisquer de seus meios ou canais de atendimento? Durante o período medido, a instituição tinha ClaveÚnica como mecanismo de autenticação utilizado pelas pessoas para acessar serviços em quaisquer de seus meios ou canais de atendimento?",20,4.0,TIC´S,9A,Resposta única. A. Sim; B. Não,0.38,sim: 0.38; não 0
chile,2025,I,recursos_institucionais,Recursos Digitais,"Durante o período medido, a instituição tinha identificados seus ativos de informação?","Durante o período medido, a instituição tinha identificados seus ativos de informação?",4,Questão,"Recursos Digitais Durante o período medido, a instituição tinha identificados seus ativos de informação? Durante o período medido, a instituição tinha identificados seus ativos de informação?",20,4.0,TIC´S,10,Resposta única. A. Sim; B. Não,0.4,sim: 0.40; não 0
chile,2025,I,recursos_institucionais,Recursos Digitais,"Durante o período medido, sua instituição contou com um software especializado para apoiar alguma das seguintes funções? Marque todas as opções correspondentes.","Durante o período medido, sua instituição contou com um software especializado para apoiar alguma das seguintes funções? Marque todas as opções correspondentes.",4,Questão,"Recursos Digitais Durante o período medido, sua instituição contou com um software especializado para apoiar alguma das seguintes funções? Marque todas as opções correspondentes. Durante o período medido, sua instituição contou com um software especializado para apoiar alguma das seguintes funções? Marque todas as opções correspondentes.",20,4.0,TIC´S,11,"A. Gestão documental. B. Gestão de inventário e ativos fixos. C. Gestão de pessoas (assiduidade, licenças, remunerações). D. Gestão financeira (arrecadação/tesouraria/contabilidade). E. Gestão de compras e aquisições. F. Gestão de clientes/usuários (CRM). G. Digitalização de processos (BPMS). H. Ofimática (processador de texto, planilha etc.). I. Repositorio documental. J. Outros (as) especifique as funções. K. Nenhuma das anteriores. (Se marcar essa não é possível marcar as demais)",0,
chile,2025,I,recursos_institucionais,Recursos Digitais,"Quantidade de sistemas que possuem considerando gestão de pessoas, gestão de clientes/usuários (CRM), digitalização de processos (BPMS) e ofimática.","Quantidade de sistemas que possuem considerando gestão de pessoas, gestão de clientes/usuários (CRM), digitalização de processos (BPMS) e ofimática.",4,Questão,"Recursos Digitais Quantidade de sistemas que possuem considerando gestão de pessoas, gestão de clientes/usuários (CRM), digitalização de processos (BPMS) e ofimática. Quantidade de sistemas que possuem considerando gestão de pessoas, gestão de clientes/usuários (CRM), digitalização de processos (BPMS) e ofimática.",20,4.0,TIC´S,11A,,,
chile,2025,I,recursos_institucionais,Recursos Digitais,Quantas das ferramentas indicadas acima eram fornecidas pela instituição a partir de hospedagem própria ou mista?,Quantas das ferramentas indicadas acima eram fornecidas pela instituição a partir de hospedagem própria ou mista?,4,Questão,Recursos Digitais Quantas das ferramentas indicadas acima eram fornecidas pela instituição a partir de hospedagem própria ou mista? Quantas das ferramentas indicadas acima eram fornecidas pela instituição a partir de hospedagem própria ou mista?,20,4.0,TIC´S,11.B,,,
chile,2025,I,recursos_institucionais,Recursos Digitais,Quais dos seguintes lineamentos e/ou políticas são utilizados na sua instituição?,Quais dos seguintes lineamentos e/ou políticas são utilizados na sua instituição?,4,Questão,Recursos Digitais Quais dos seguintes lineamentos e/ou políticas são utilizados na sua instituição? Quais dos seguintes lineamentos e/ou políticas são utilizados na sua instituição?,20,4.0,TIC´S,12,Marque todas as opções correspondentes. A. Política de Segurança da Informação. B. Política de Cibersegurança. C. Processos associados à Segurança da Informação. D. Processos associados à Cibersegurança. E. Procedimentos associados à Segurança da Informação. F. Procedimentos associados à Cibersegurança. G. Plano de continuidade de negócios (BCP) para seus processos e produtos estratégicos. H. Plano de recuperação de desastres (DRP) para seus processos e produtos estratégicos. I. Nenhum dos anteriores.,0.82,"0.1025
0.1025
0.1025
0.1025
0.1025
0.1025
0.1025
0.1025
0"
chile,2025,I,recursos_institucionais,Recursos Digitais,"Durante o período medido, a instituição contava com um plano de ação e/ou estratégia de transformação digital preparada para a aplicação da Lei de Transformação Digital (LDT)?","Durante o período medido, a instituição contava com um plano de ação e/ou estratégia de transformação digital preparada para a aplicação da Lei de Transformação Digital (LDT)?",4,Questão,"Recursos Digitais Durante o período medido, a instituição contava com um plano de ação e/ou estratégia de transformação digital preparada para a aplicação da Lei de Transformação Digital (LDT)? Durante o período medido, a instituição contava com um plano de ação e/ou estratégia de transformação digital preparada para a aplicação da Lei de Transformação Digital (LDT)?",20,4.0,Serviços Online,13,Resposta única. A. Sim; B. Não (Ir para a questão 14),0.20,sim: 0.20; não 0
chile,2025,I,recursos_institucionais,Recursos Digitais,Quais são os eixos de trabalho da estratégia de transformação digital nos quais a instituição trabalhou durante o período medido?,Quais são os eixos de trabalho da estratégia de transformação digital nos quais a instituição trabalhou durante o período medido?,4,Questão,Recursos Digitais Quais são os eixos de trabalho da estratégia de transformação digital nos quais a instituição trabalhou durante o período medido? Quais são os eixos de trabalho da estratégia de transformação digital nos quais a instituição trabalhou durante o período medido?,20,4.0,Serviços Online,13.1,"Marque todas as opções correspondentes. A. Identificação de procedimentos administrativos e trâmites. B. Envio e recepção de comunicações oficiais. C. Gestão documental: documentos e expediente eletrônico. D. Interoperabilidade: intercâmbio de dados e informação entre instituições. E. Autenticação: ClaveÚnica e/ou chave tributária. F. Qualidade das plataformas eletrônicas: catálogo, plano de melhoria etc. G. Segurança da informação e cibersegurança das plataformas. H. Redesenho e digitalização de procedimentos administrativos. I Notificações eletrônicas. J. Estratégias para fazer a Web acessível para pessoas com deficiência. K. Outros (s)? Quais?",0.20,
