sistema,ano,dimensao_id_original,dimensao_padrao,subdimensao,questao,elemento,nivel,tipo_elemento,texto_completo,pontuacao_maxima_dimensao,pontuacao_maxima_capacidade_chave,nome_variavel,numero_questao,respuesta,pontuacao_maxima_questao,pontuacao_item
chile,2025,I,recursos_institucionais,Recursos Digitais,Qual porcentagem de procedimentos administrativos em suporte eletrônico foi reportada pela instituição no Catálogo de Procedimentos Administrativos e outras Tramitações (CPAT) em 31 de maio de 2025?,Qual porcentagem de procedimentos administrativos em suporte eletrônico foi reportada pela instituição no Catálogo de Procedimentos Administrativos e outras Tramitações (CPAT) em 31 de maio de 2025?,4,Questão,Recursos Digitais Qual porcentagem de procedimentos administrativos em suporte eletrônico foi reportada pela instituição no Catálogo de Procedimentos Administrativos e outras Tramitações (CPAT) em 31 de maio de 2025? Qual porcentagem de procedimentos administrativos em suporte eletrônico foi reportada pela instituição no Catálogo de Procedimentos Administrativos e outras Tramitações (CPAT) em 31 de maio de 2025?,20,4.0,Serviços Online,13A,Respuesta numérica. Levantamento administrativo.,0.35,
chile,2025,I,recursos_institucionais,Recursos Digitais,"Durante o período medido, quais atividades a instituição realizava habitualmente para o desenho e/ou desenvolvimento de seus serviços digitais?","Durante o período medido, quais atividades a instituição realizava habitualmente para o desenho e/ou desenvolvimento de seus serviços digitais?",4,Questão,"Recursos Digitais Durante o período medido, quais atividades a instituição realizava habitualmente para o desenho e/ou desenvolvimento de seus serviços digitais? Durante o período medido, quais atividades a instituição realizava habitualmente para o desenho e/ou desenvolvimento de seus serviços digitais?",20,4.0,Serviços Online,14,"Marque todas as opções correspondentes.  A. Auditorias de acessibilidade. B. Pesquisa qualitativa (por exemplo, entrevistas, focus groups). C. Pesquisa quantitativa (por exemplo, utilizando ferramentas de análise web, como Google Analytics). D. Geração de protótipos e testes. E. Testes de usabilidade. F. Outra(s). Especifique: G. Nenhuma das anteriores.",0.15,
chile,2025,I,recursos_institucionais,Recursos Digitais,"Durante o período medido, a instituição realizou medições de satisfação dos usuários de seus serviços digitais?","Durante o período medido, a instituição realizou medições de satisfação dos usuários de seus serviços digitais?",4,Questão,"Recursos Digitais Durante o período medido, a instituição realizou medições de satisfação dos usuários de seus serviços digitais? Durante o período medido, a instituição realizou medições de satisfação dos usuários de seus serviços digitais?",20,4.0,Serviços Online,15,Resposta única. A. Sim; B. Não (Ir para a questão 16),0.2,sim: 0.2; não 0
chile,2025,I,recursos_institucionais,Recursos Digitais,¿En qué medida aplicó la medición de satisfacción usuaria de sus servicios digitales?,¿En qué medida aplicó la medición de satisfacción usuaria de sus servicios digitales?,4,Questão,Recursos Digitais ¿En qué medida aplicó la medición de satisfacción usuaria de sus servicios digitales? ¿En qué medida aplicó la medición de satisfacción usuaria de sus servicios digitales?,20,4.0,Serviços Online,15.1,"Respuesta única.
A. En todos sus servicios digitales.
B. En algún(os) de sus servicios digitales.",0,
chile,2025,I,recursos_institucionais,Recursos Digitais,Para que a instituição utiliza a informação obtida das medições de satisfação usuária?,Para que a instituição utiliza a informação obtida das medições de satisfação usuária?,4,Questão,Recursos Digitais Para que a instituição utiliza a informação obtida das medições de satisfação usuária? Para que a instituição utiliza a informação obtida das medições de satisfação usuária?,20,4.0,Serviços Online,15.2,"Marque todas as opções correspondentes.  A. Desenho de novos serviços. B. Melhoria contínua. C. Relato para outras áreas da instituição. D. Análise de demanda (por exemplo, para identificar necessidades não atendidas, lacunas de cobertura ou priorizar serviços conforme os resultados de satisfação). E. Outro. Especifique:",0.35,
chile,2025,I,recursos_institucionais,Recursos Digitais,"Durante el periodo medido, ¿la institución utilizó alguno de los siguientes tipos de aplicaciones basadas en Inteligencia Artificial (IA) en sus procesos internos o en la entrega de servicios a la ciudadanía?","Durante el periodo medido, ¿la institución utilizó alguno de los siguientes tipos de aplicaciones basadas en Inteligencia Artificial (IA) en sus procesos internos o en la entrega de servicios a la ciudadanía?",4,Questão,"Recursos Digitais Durante el periodo medido, ¿la institución utilizó alguno de los siguientes tipos de aplicaciones basadas en Inteligencia Artificial (IA) en sus procesos internos o en la entrega de servicios a la ciudadanía? Durante el periodo medido, ¿la institución utilizó alguno de los siguientes tipos de aplicaciones basadas en Inteligencia Artificial (IA) en sus procesos internos o en la entrega de servicios a la ciudadanía?",20,4.0,Uso de IA,16,"Marque todas as opções correspondentes. A. Assistentes virtuais ou chatbots baseados em IA para interagir com pessoas usuárias. B. Processamento automatizado de texto ou dados por IA. C. Automação de processos com decisões inteligentes. D. Modelos preditivos ou de classificação para antecipar decisões institucionais. E. Detecção automatizada de fraudes, inconsistências ou anomalias. F. Algoritmos de recomendação de serviços para pessoas usuárias. G. Outro(s). Qual(is)? H. Não utilizou ferramentas de IA durante este período. Se marcar esta opção, não é possível assinalar as demais.",0,
chile,2025,I,recursos_institucionais,Estratégia e governança,"Durante o período medido, existia uma governança institucional dedicada especificamente a desenvolver ou gerir inovação dentro da instituição?","Durante o período medido, existia uma governança institucional dedicada especificamente a desenvolver ou gerir inovação dentro da instituição?",4,Questão,"Estratégia e governança Durante o período medido, existia uma governança institucional dedicada especificamente a desenvolver ou gerir inovação dentro da instituição? Durante o período medido, existia uma governança institucional dedicada especificamente a desenvolver ou gerir inovação dentro da instituição?",20,8.0,area de inovação,17,Resposta única. A. Sim; B. Não (Ir para a questão 18),1,
chile,2025,I,recursos_institucionais,Estratégia e governança,Qual dos seguintes tipos de governança para a inovação estava vigente na instituição nesse período?,Qual dos seguintes tipos de governança para a inovação estava vigente na instituição nesse período?,4,Questão,Estratégia e governança Qual dos seguintes tipos de governança para a inovação estava vigente na instituição nesse período? Qual dos seguintes tipos de governança para a inovação estava vigente na instituição nesse período?,20,8.0,area de inovação,17.1,"Resposta única. A. Departamento de Innovación.
B. División de Innovación.
C. Oficina de Innovación.
D. Unidad de Innovación.
E. Comité de Innovación.
F. Otra. Especifique:",0.6,0.6
chile,2025,I,recursos_institucionais,Estratégia e governança,De qual subdireção/subdepartamento/departamento dependia a governança mencionada?,De qual subdireção/subdepartamento/departamento dependia a governança mencionada?,4,Questão,Estratégia e governança De qual subdireção/subdepartamento/departamento dependia a governança mencionada? De qual subdireção/subdepartamento/departamento dependia a governança mencionada?,20,8.0,area de inovação,17.2,Se respondeu que sim a pergunta 17. Si es más de una señale la depedencia específica de cada una. Máximo 3000 caracteres.,0,0
chile,2025,I,recursos_institucionais,Estratégia e governança,Qual é o orçamento disponível para a governança de inovação durante o ano de 2025?,Qual é o orçamento disponível para a governança de inovação durante o ano de 2025?,4,Questão,Estratégia e governança Qual é o orçamento disponível para a governança de inovação durante o ano de 2025? Qual é o orçamento disponível para a governança de inovação durante o ano de 2025?,20,8.0,area de inovação,17.3,Se respondeu que sim a pergunta 17. Resposta númerica.,0.4,0.4
chile,2025,I,recursos_institucionais,Estratégia e governança,A dependência da governança à qual se faz referência era transversal?,A dependência da governança à qual se faz referência era transversal?,4,Questão,Estratégia e governança A dependência da governança à qual se faz referência era transversal? A dependência da governança à qual se faz referência era transversal?,20,8.0,area de inovação,17A,"Proviene de la respuesta entregada en la pregunta 17.2 por la institución. Levantamiento
administrativo.
A. Sí, completamente.
B. Sí, parcialmente.
C. No.",1,1; 0.7; 0
chile,2025,I,recursos_institucionais,Estratégia e governança,Qual é o orçamento inicial total da instituição para o ano de 2025?,Qual é o orçamento inicial total da instituição para o ano de 2025?,4,Questão,Estratégia e governança Qual é o orçamento inicial total da instituição para o ano de 2025? Qual é o orçamento inicial total da instituição para o ano de 2025?,20,8.0,Inovação em objetivos estratégicos,17B,Resposta númerica. Levantamento administrativo.,0,0
chile,2025,I,recursos_institucionais,Estratégia e governança,"O formulário A1 da instituição vigente durante o período medido, especificamente na seção de Objetivos Estratégicos Institucionais, contém algum objetivo relacionado com inovação?","O formulário A1 da instituição vigente durante o período medido, especificamente na seção de Objetivos Estratégicos Institucionais, contém algum objetivo relacionado com inovação?",4,Questão,"Estratégia e governança O formulário A1 da instituição vigente durante o período medido, especificamente na seção de Objetivos Estratégicos Institucionais, contém algum objetivo relacionado com inovação? O formulário A1 da instituição vigente durante o período medido, especificamente na seção de Objetivos Estratégicos Institucionais, contém algum objetivo relacionado com inovação?",20,8.0,Inovação em objetivos estratégicos,18,"A IAN corresponde ao formulário A1 ou, em seu defeito, à declaração de contas públicas.
A. Sí
B. No",2.5,sim: 2.5; não 0
chile,2025,I,recursos_institucionais,Estratégia e governança,"Durante o período medido, a instituição contou com alguma estratégia ou plano de ação relacionado com inovação pública?","Durante o período medido, a instituição contou com alguma estratégia ou plano de ação relacionado com inovação pública?",4,Questão,"Estratégia e governança Durante o período medido, a instituição contou com alguma estratégia ou plano de ação relacionado com inovação pública? Durante o período medido, a instituição contou com alguma estratégia ou plano de ação relacionado com inovação pública?",20,8.0,Inovação em objetivos estratégicos,19,,,
chile,2025,II,praticas_e_processos,,,Práticas e processos,1,Dimensão,Práticas e processos,40,,,,,,
chile,2025,II,praticas_e_processos,Atividade e praticas,,Atividade e praticas,2,Subdimensão,Atividade e praticas,40,14.0,,,,,
chile,2025,II,praticas_e_processos,Atividade e praticas,"Durante o período medido, quantas iniciativas de inovação pública a instituição desenvolveu?","Durante o período medido, quantas iniciativas de inovação pública a instituição desenvolveu?",4,Questão,"Atividade e praticas Durante o período medido, quantas iniciativas de inovação pública a instituição desenvolveu? Durante o período medido, quantas iniciativas de inovação pública a instituição desenvolveu?",40,14.0,Variáveis base,20,o período considerado é de 1º de junho de 2024 a 31 de maio de 2025. A. Nenhuma (Ir para a questão 20) B. 1 C. 2 D. 3 E. 4 F. 5,0.6,
chile,2025,II,praticas_e_processos,Atividade e praticas,Indique o nome de cada iniciativa: 1. 2… (Responder 1 ou mias iniciativas referente a pregunta anterior),Indique o nome de cada iniciativa: 1. 2… (Responder 1 ou mias iniciativas referente a pregunta anterior),4,Questão,Atividade e praticas Indique o nome de cada iniciativa: 1. 2… (Responder 1 ou mias iniciativas referente a pregunta anterior) Indique o nome de cada iniciativa: 1. 2… (Responder 1 ou mias iniciativas referente a pregunta anterior),40,14.0,Variáveis base,20.1,Máximo de 100 caracteres.,0,0
chile,2025,II,praticas_e_processos,Atividade e praticas,"Em relação à iniciativa [inserir nome], qual foi o problema inicial que se buscou abordar mediante um processo de inovação?","Em relação à iniciativa [inserir nome], qual foi o problema inicial que se buscou abordar mediante um processo de inovação?",4,Questão,"Atividade e praticas Em relação à iniciativa [inserir nome], qual foi o problema inicial que se buscou abordar mediante um processo de inovação? Em relação à iniciativa [inserir nome], qual foi o problema inicial que se buscou abordar mediante um processo de inovação?",40,14.0,Variáveis base,20.2,Máximo de 3000 caracteres.,0,0
chile,2025,II,praticas_e_processos,Atividade e praticas,"Em relação à iniciativa [inserir nome], quais dos seguintes atores estiveram envolvidos na identificação do problema inicial?","Em relação à iniciativa [inserir nome], quais dos seguintes atores estiveram envolvidos na identificação do problema inicial?",4,Questão,"Atividade e praticas Em relação à iniciativa [inserir nome], quais dos seguintes atores estiveram envolvidos na identificação do problema inicial? Em relação à iniciativa [inserir nome], quais dos seguintes atores estiveram envolvidos na identificação do problema inicial?",40,14.0,Surgimento da necessidade,20.3,A. Pessoas usuárias/beneficiárias. B. As pessoas que trabalham na entidade. C. A autoridade do serviço. Que cargo? D. Outra instituição pública. E. Outra instituição fora do Estado. F. Outro(s). Qual(is)?,1.5,0.5; 0.5; 0.10; 0.20; 0.20; 0
chile,2025,II,praticas_e_processos,Atividade e praticas,"Em relação à iniciativa [inserir nome], de que maneira a iniciativa de inovação contribui para resolver o problema identificado?","Em relação à iniciativa [inserir nome], de que maneira a iniciativa de inovação contribui para resolver o problema identificado?",4,Questão,"Atividade e praticas Em relação à iniciativa [inserir nome], de que maneira a iniciativa de inovação contribui para resolver o problema identificado? Em relação à iniciativa [inserir nome], de que maneira a iniciativa de inovação contribui para resolver o problema identificado?",40,14.0,Desenvolvimento da iniciativa,20.4,"Deve-se descrever como a inovação melhora a situação inicial ou resolve o problema identificado, indicando que mudança gera e por que seria efetiva diante da situação que se busca abordar. Máximo de 3000 caracteres.",0,0
chile,2025,II,praticas_e_processos,Atividade e praticas,"Em relação à iniciativa [inserir nome], durante o período medido, foi realizada uma investigação do problema inicial antes de idealizar soluções?","Em relação à iniciativa [inserir nome], durante o período medido, foi realizada uma investigação do problema inicial antes de idealizar soluções?",4,Questão,"Atividade e praticas Em relação à iniciativa [inserir nome], durante o período medido, foi realizada uma investigação do problema inicial antes de idealizar soluções? Em relação à iniciativa [inserir nome], durante o período medido, foi realizada uma investigação do problema inicial antes de idealizar soluções?",40,14.0,Desenvolvimento da iniciativa,20.5,Resposta única. A. Sim; B. Não,0,0
chile,2025,II,praticas_e_processos,Atividade e praticas,Quais dos seguintes atores externos participaram da fase de investigação do problema inicial?,Quais dos seguintes atores externos participaram da fase de investigação do problema inicial?,4,Questão,Atividade e praticas Quais dos seguintes atores externos participaram da fase de investigação do problema inicial? Quais dos seguintes atores externos participaram da fase de investigação do problema inicial?,40,14.0,Desenvolvimento da iniciativa,20.6,"Marque todos os correspondentes. Validaremos a resposta apresentada com a Informação Adicional Necessária (IAN) solicitada na pergunta 20.7.N. ¿Cuáles de los siguientes actores externos participaron en la fase
investigación del problema inicial?
Si contestó No en la pregunta anterior, debe marcar la alternativa “D.Ninguno”.
Marque todos los que correspondan. Validaremos la respuesta entregada con la Información
Adicional Necesaria (IAN) requerida en la pregunta 20.5.N.
A. Personas usuarias o beneficiarias del servicio.
B. Otra(s) entidad(es) del Estado.
C. Otra(s) entidad(es) fuera del Estado.
D. Ninguno.
Si marca esta, no es posible señalar las demás.",0,0
chile,2025,II,praticas_e_processos,Atividade e praticas,"Em relação à iniciativa [inserir nome], durante o período medido, ela foi desenhada?","Em relação à iniciativa [inserir nome], durante o período medido, ela foi desenhada?",4,Questão,"Atividade e praticas Em relação à iniciativa [inserir nome], durante o período medido, ela foi desenhada? Em relação à iniciativa [inserir nome], durante o período medido, ela foi desenhada?",40,14.0,Desenvolvimento da iniciativa,20.7,Resposta única. A. Sim; B. Não,1.5,
chile,2025,II,praticas_e_processos,Atividade e praticas,Quais dos seguintes atores externos participaram da fase de desenho?,Quais dos seguintes atores externos participaram da fase de desenho?,4,Questão,Atividade e praticas Quais dos seguintes atores externos participaram da fase de desenho? Quais dos seguintes atores externos participaram da fase de desenho?,40,14.0,Desenvolvimento da iniciativa,20.8,"Marque todos os correspondentes. Validaremos a resposta apresentada com a Informação Adicional Necessária (IAN) solicitada na pergunta 20.7.N. ¿Cuáles de los siguientes actores externos participaron en la fase de diseño?
Si contestó No en la pregunta anterior, debe marcar la alternativa “D.Ninguno”.
Marque todos los que correspondan. Validaremos la respuesta entregada con la Información
Adicional Necesaria (IAN) requerida en la pregunta 20.7.N.
A. Personas usuarias o beneficiarias del servicio.
B. Otra(s) entidad(es) del Estado.
C. Otra(s) entidad(es) fuera del Estado.
D. Ninguno.
Si marca esta, no es posible señalar las demás.",,
chile,2025,II,praticas_e_processos,Atividade e praticas,"Em relação à iniciativa [inserir nome], durante o período medido, ela foi prototipada?","Em relação à iniciativa [inserir nome], durante o período medido, ela foi prototipada?",4,Questão,"Atividade e praticas Em relação à iniciativa [inserir nome], durante o período medido, ela foi prototipada? Em relação à iniciativa [inserir nome], durante o período medido, ela foi prototipada?",40,14.0,Desenvolvimento da iniciativa,20.9,Resposta única. A. Sim; B. Não,1.8,
chile,2025,II,praticas_e_processos,Atividade e praticas,Quais dos seguintes atores externos participaram da fase de prototipagem?,Quais dos seguintes atores externos participaram da fase de prototipagem?,4,Questão,Atividade e praticas Quais dos seguintes atores externos participaram da fase de prototipagem? Quais dos seguintes atores externos participaram da fase de prototipagem?,40,14.0,Desenvolvimento da iniciativa,20.10,"Marque todos os correspondentes. Validaremos a resposta apresentada com a Informação Adicional Necessária (IAN) solicitada na pergunta 20.9.N. ¿Cuáles de los siguientes actores externos participaron en la fase de
prototipado?
Si contestó No en la pregunta anterior, debe marcar la alternativa “D.Ninguno”.
Marque todos los que correspondan. Validaremos la respuesta entregada con la Información
Adicional Necesaria (IAN) requerida en la pregunta 20.9.N.
A. Personas usuarias o beneficiarias del servicio.
B. Otra(s) entidad(es) del Estado.
C. Otra(s) entidad(es) fuera del Estado.
D. Ninguno.
Si marca esta, no es posible señalar las demás.",0,0
chile,2025,II,praticas_e_processos,Atividade e praticas,"Em relação à iniciativa [inserir nome], durante o período medido, ela foi testada e ajustada a partir dos resultados obtidos?","Em relação à iniciativa [inserir nome], durante o período medido, ela foi testada e ajustada a partir dos resultados obtidos?",4,Questão,"Atividade e praticas Em relação à iniciativa [inserir nome], durante o período medido, ela foi testada e ajustada a partir dos resultados obtidos? Em relação à iniciativa [inserir nome], durante o período medido, ela foi testada e ajustada a partir dos resultados obtidos?",40,14.0,Desenvolvimento da iniciativa,20.11,Resposta única. A. Sim; B. Não,1.5,
chile,2025,II,praticas_e_processos,Atividade e praticas,Quais dos seguintes atores externos participaram da fase de testes e ajustes da solução?,Quais dos seguintes atores externos participaram da fase de testes e ajustes da solução?,4,Questão,Atividade e praticas Quais dos seguintes atores externos participaram da fase de testes e ajustes da solução? Quais dos seguintes atores externos participaram da fase de testes e ajustes da solução?,40,14.0,Desenvolvimento da iniciativa,20.12,"Marque todos os correspondentes. Validaremos a resposta apresentada com a Informação Adicional Necessária (IAN) solicitada na pergunta 20.11.N. ¿Cuáles de los siguientes actores externos participaron en la fase de testeo y
ajuste de la solución?
Si contestó No en la pregunta anterior, debe marcar la alternativa “D.Ninguno”.
Marque todos los que correspondan. Validaremos la respuesta entregada con la Información
Adicional Necesaria (IAN) requerida en la pregunta 20.11.N.
A. Personas usuarias o beneficiarias del servicio.
B. Otra(s) entidad(es) del Estado.
C. Otra(s) entidad(es) fuera del Estado.
D. Ninguno.
Si marca esta, no es posible señalar las demás.",0,
chile,2025,II,praticas_e_processos,Atividade e praticas,"Em relação à iniciativa [inserir nome], durante o período medido, ela foi pilotada?","Em relação à iniciativa [inserir nome], durante o período medido, ela foi pilotada?",4,Questão,"Atividade e praticas Em relação à iniciativa [inserir nome], durante o período medido, ela foi pilotada? Em relação à iniciativa [inserir nome], durante o período medido, ela foi pilotada?",40,14.0,Desenvolvimento da iniciativa,20.13,Resposta única. A. Sim; B. Não,1.4,
chile,2025,II,praticas_e_processos,Atividade e praticas,Quais dos seguintes atores externos participaram da fase de pilotagem da solução?,Quais dos seguintes atores externos participaram da fase de pilotagem da solução?,4,Questão,Atividade e praticas Quais dos seguintes atores externos participaram da fase de pilotagem da solução? Quais dos seguintes atores externos participaram da fase de pilotagem da solução?,40,14.0,Desenvolvimento da iniciativa,20.14,"Marque todos os correspondentes. Validaremos a resposta apresentada com a Informação Adicional Necessária (IAN) solicitada na pergunta 20.13.N. ¿Cuáles de los siguientes actores externos participaron en la fase de pilotaje
de la solución?
Si contestó No en la pregunta anterior, debe marcar la alternativa “D.Ninguno”.
Marque todos los que correspondan. Validaremos la respuesta entregada con la Información
Adicional Necesaria (IAN) requerida en la pregunta 20.13.N.
A. Personas usuarias o beneficiarias del servicio.
B. Otra(s) entidad(es) del Estado.
C. Otra(s) entidad(es) fuera del Estado.
D. Ninguno.
Si marca esta, no es posible señalar las demás.",0,
chile,2025,II,praticas_e_processos,Atividade e praticas,"Em relação à iniciativa [inserir nome], durante o período medido, ela foi implementada?","Em relação à iniciativa [inserir nome], durante o período medido, ela foi implementada?",4,Questão,"Atividade e praticas Em relação à iniciativa [inserir nome], durante o período medido, ela foi implementada? Em relação à iniciativa [inserir nome], durante o período medido, ela foi implementada?",40,14.0,Desenvolvimento da iniciativa,20.15,Resposta única. A. Sim; B. Não,1.4,
chile,2025,II,praticas_e_processos,Atividade e praticas,Quais dos seguintes atores externos participaram da fase de implementação da solução?,Quais dos seguintes atores externos participaram da fase de implementação da solução?,4,Questão,Atividade e praticas Quais dos seguintes atores externos participaram da fase de implementação da solução? Quais dos seguintes atores externos participaram da fase de implementação da solução?,40,14.0,Desenvolvimento da iniciativa,20.16,"Marque todos os correspondentes. Validaremos a resposta apresentada com a Informação Adicional Necessária (IAN) solicitada na pergunta 20.15.N. ¿Cuáles de los siguientes actores externos participaron en la fase de
implementación de la solución?
Si contestó No en la pregunta anterior, debe marcar la alternativa “D.Ninguno”.
Marque todos los que correspondan. Validaremos la respuesta entregada con la Información
Adicional Necesaria (IAN) requerida en la pregunta 20.15.N.
A. Personas usuarias o beneficiarias del servicio.
B. Otra(s) entidad(es) del Estado.
C. Otra(s) entidad(es) fuera del Estado.
D. Ninguno.
Si marca esta, no es posible señalar las demás.",0,
