sistema,ano,dimensao_id_original,dimensao_padrao,subdimensao,questao,elemento,nivel,tipo_elemento,texto_completo,pontuacao_maxima_dimensao,pontuacao_maxima_capacidade_chave,nome_variavel,numero_questao,respuesta,pontuacao_maxima_questao,pontuacao_item
chile,2025,II,praticas_e_processos,Atividade e praticas,"Em relação à iniciativa [inserir nome], durante o período medido, que tipo de avaliação foi realizada no contexto do pilotagem ou após ser implementada?","Em relação à iniciativa [inserir nome], durante o período medido, que tipo de avaliação foi realizada no contexto do pilotagem ou após ser implementada?",4,Questão,"Atividade e praticas Em relação à iniciativa [inserir nome], durante o período medido, que tipo de avaliação foi realizada no contexto do pilotagem ou após ser implementada? Em relação à iniciativa [inserir nome], durante o período medido, que tipo de avaliação foi realizada no contexto do pilotagem ou após ser implementada?",40,14.0,Desenvolvimento da iniciativa,20.17,"Respuesta única.
A. Evaluación de procesos (optimización, “de flujos”)
B. Evaluación de impacto (método no experimental, cuasi experimental o
experimental)
C. Evaluación de eficiencia (costo-beneficio o costo-efectividad)
D. Otra. ¿Cuál(es)?
E. Ninguna de las anteriores
Si marca esta, no es posible señalar las demás.",1.2,
chile,2025,II,praticas_e_processos,Atividade e praticas,Quais dos seguintes atores externos participaram da fase de avaliação da solução?,Quais dos seguintes atores externos participaram da fase de avaliação da solução?,4,Questão,Atividade e praticas Quais dos seguintes atores externos participaram da fase de avaliação da solução? Quais dos seguintes atores externos participaram da fase de avaliação da solução?,40,14.0,Desenvolvimento da iniciativa,20.18,"Marque todos os correspondentes. Validaremos a resposta apresentada com a Informação Adicional Necessária (IAN) solicitada na pergunta 20.17.N. A. Personas usuarias o beneficiarias del servicio.
B. Otra(s) entidad(es) del Estado.
C. Otra(s) entidad(es) fuera del Estado.
D. Ninguno.
Si marca esta, no es posible señalar las demás.",0,
chile,2025,II,praticas_e_processos,Atividade e praticas,"Em relação à iniciativa [inserir nome], participaram pessoas usuárias, outras instituições públicas ou instituições fora do Estado em uma ou mais de suas fases?","Em relação à iniciativa [inserir nome], participaram pessoas usuárias, outras instituições públicas ou instituições fora do Estado em uma ou mais de suas fases?",4,Questão,"Atividade e praticas Em relação à iniciativa [inserir nome], participaram pessoas usuárias, outras instituições públicas ou instituições fora do Estado em uma ou mais de suas fases? Em relação à iniciativa [inserir nome], participaram pessoas usuárias, outras instituições públicas ou instituições fora do Estado em uma ou mais de suas fases?",40,14.0,Desenvolvimento da iniciativa,20.19,"Respuesta única. La respuesta será validada con la Información Adicional Necesaria (IAN)
entregada en las preguntas correspondientes a las fases de la iniciativa (preguntas 20.5.N,
20.7.N, .N, 20.9.N, 20.11.N, 20.13.N, 20.15.N, 20.17.N) A. SIM; B. NO",1,
chile,2025,II,praticas_e_processos,Atividade e praticas,"Em relação à iniciativa [inserir nome], durante o período medido, quais das seguintes atividades relacionadas à gestão da mudança ou à adoção da solução foram desenvolvidas?","Em relação à iniciativa [inserir nome], durante o período medido, quais das seguintes atividades relacionadas à gestão da mudança ou à adoção da solução foram desenvolvidas?",4,Questão,"Atividade e praticas Em relação à iniciativa [inserir nome], durante o período medido, quais das seguintes atividades relacionadas à gestão da mudança ou à adoção da solução foram desenvolvidas? Em relação à iniciativa [inserir nome], durante o período medido, quais das seguintes atividades relacionadas à gestão da mudança ou à adoção da solução foram desenvolvidas?",40,14.0,Desenvolvimento da iniciativa,20.20,Marque todas as opções correspondentes. A. Difusão da iniciativa no interior da organização. B. Plano de comunicação e difusão com usuários e atores-chave. C. Instalação de capacidades nas equipes executoras. D. Criação de uma rede de apoio ou equipes de gestão da mudança. E. Envolvimento das autoridades institucionais na iniciativa. F. Desenho de estratégias de gestão da mudança para enfrentar resistências. G. Outra. Qual? H. Nenhuma das anteriores.,1.1,"0.175
0.175
0.175
0.175
0.175; 0.175
0.175
0"
chile,2025,II,praticas_e_processos,Atividade e praticas,"Em relação à iniciativa [inserir nome], durante o período medido, foram executadas ou planejadas ações para o seu escalonamento?","Em relação à iniciativa [inserir nome], durante o período medido, foram executadas ou planejadas ações para o seu escalonamento?",4,Questão,"Atividade e praticas Em relação à iniciativa [inserir nome], durante o período medido, foram executadas ou planejadas ações para o seu escalonamento? Em relação à iniciativa [inserir nome], durante o período medido, foram executadas ou planejadas ações para o seu escalonamento?",40,14.0,Desenvolvimento da iniciativa,20.21,"Sólo si contestó “sí” en alguna de las siguientes fases: Pilotaje, Implementación, Evaluación
(preguntas 20.13.N, 20.15.N y 20.17.N). Si en todas ellas respondió “No”, deberá responder “No” en esta pregunta.Resposta Única.  A. SIM B. NO",0,
chile,2025,II,praticas_e_processos,Atividade e praticas,"Em relação à iniciativa [inserir nome], quantas áreas, em nível de unidades funcionais, estiveram ativamente envolvidas em uma ou mais de suas fases?","Em relação à iniciativa [inserir nome], quantas áreas, em nível de unidades funcionais, estiveram ativamente envolvidas em uma ou mais de suas fases?",4,Questão,"Atividade e praticas Em relação à iniciativa [inserir nome], quantas áreas, em nível de unidades funcionais, estiveram ativamente envolvidas em uma ou mais de suas fases? Em relação à iniciativa [inserir nome], quantas áreas, em nível de unidades funcionais, estiveram ativamente envolvidas em uma ou mais de suas fases?",40,14.0,Desenvolvimento da iniciativa,20.22,Máximo de 3000 caracteres.,0,
chile,2025,II,praticas_e_processos,Atividade e praticas,"Em relação à iniciativa [inserir nome], ela contou com financiamento em pelo menos uma de suas fases?","Em relação à iniciativa [inserir nome], ela contou com financiamento em pelo menos uma de suas fases?",4,Questão,"Atividade e praticas Em relação à iniciativa [inserir nome], ela contou com financiamento em pelo menos uma de suas fases? Em relação à iniciativa [inserir nome], ela contou com financiamento em pelo menos uma de suas fases?",40,14.0,Desenvolvimento da iniciativa,20.23,Resposta única. A. Sim; B. Não,0,0
chile,2025,II,praticas_e_processos,Atividade e praticas,"Em relação à iniciativa [inserir nome], quais das seguintes dificuldades foram encontradas durante o desenvolvimento da iniciativa?","Em relação à iniciativa [inserir nome], quais das seguintes dificuldades foram encontradas durante o desenvolvimento da iniciativa?",4,Questão,"Atividade e praticas Em relação à iniciativa [inserir nome], quais das seguintes dificuldades foram encontradas durante o desenvolvimento da iniciativa? Em relação à iniciativa [inserir nome], quais das seguintes dificuldades foram encontradas durante o desenvolvimento da iniciativa?",40,14.0,Desenvolvimento da iniciativa,20.24,Selecione as 3 principais. A. Obter financiamento para o seu desenvolvimento. B. Cultura organizacional. C. Marco normativo e/ou administrativo. D. Interoperabilidade entre sistemas. E. Adoção de novas tecnologias. G. Outra. Qual? G. Nenhuma das anteriores.,0,
chile,2025,II,praticas_e_processos,Atividade e praticas,"Em relação à iniciativa [inserir nome], a perspectiva de gênero foi incorporada em pelo menos uma de suas etapas?","Em relação à iniciativa [inserir nome], a perspectiva de gênero foi incorporada em pelo menos uma de suas etapas?",4,Questão,"Atividade e praticas Em relação à iniciativa [inserir nome], a perspectiva de gênero foi incorporada em pelo menos uma de suas etapas? Em relação à iniciativa [inserir nome], a perspectiva de gênero foi incorporada em pelo menos uma de suas etapas?",40,14.0,Desenvolvimento da iniciativa,20.25,Resposta única. A. Sim; B. Não,0,
chile,2025,II,praticas_e_processos,Atividade e praticas,"En relación a la iniciativa [insertar nombre], ¿cuáles fueron los resultados concretos y medibles que se observaron luego de su
pilotaje o implementación? En caso que aún no haya sido piloteada o implementada, indique los resultados esperados.","En relación a la iniciativa [insertar nombre], ¿cuáles fueron los resultados concretos y medibles que se observaron luego de su
pilotaje o implementación? En caso que aún no haya sido piloteada o implementada, indique los resultados esperados.",4,Questão,"Atividade e praticas En relación a la iniciativa [insertar nombre], ¿cuáles fueron los resultados concretos y medibles que se observaron luego de su
pilotaje o implementación? En caso que aún no haya sido piloteada o implementada, indique los resultados esperados. En relación a la iniciativa [insertar nombre], ¿cuáles fueron los resultados concretos y medibles que se observaron luego de su
pilotaje o implementación? En caso que aún no haya sido piloteada o implementada, indique los resultados esperados.",40,14.0,Resultado da iniciativa,20.26,"Marque todas las que correspondan.
A. Mejora en la satisfacción de los usuarios.
B. Disminución en el tiempo de uno o más procedimientos administrativos.
C. Mayor eficiencia en el uso de los recursos públicos.
D. Incremento en la cobertura de atención.
E. Otros. Especifique:
F. Ninguna de las anteriores.
Si marca esta, no es posible señalar las demás.",0,
chile,2025,II,praticas_e_processos,Atividade e praticas,"En relación a la iniciativa [insertar nombre], ¿quiénes eran los destinatarios o beneficiarios principales de la solución?","En relación a la iniciativa [insertar nombre], ¿quiénes eran los destinatarios o beneficiarios principales de la solución?",4,Questão,"Atividade e praticas En relación a la iniciativa [insertar nombre], ¿quiénes eran los destinatarios o beneficiarios principales de la solución? En relación a la iniciativa [insertar nombre], ¿quiénes eran los destinatarios o beneficiarios principales de la solución?",40,14.0,Resultado da iniciativa,20.27,"Marque todas las que correspondan.
A. Las personas usuarias de la entidad.
B. Otras instituciones públicas.
C. Empresas o entidades del sector privado.
D. Las personas funcionarias de la entidad.
E. Otro destinatario o beneficiario. ¿Cuál(es)?",0,
chile,2025,II,praticas_e_processos,Atividade e praticas,"De las iniciativas validadas, ¿cuántas tienen alta relevancia estratégica?
Si contestó “1 o más iniciativas” en la pregunta N.","De las iniciativas validadas, ¿cuántas tienen alta relevancia estratégica?
Si contestó “1 o más iniciativas” en la pregunta N.",4,Questão,"Atividade e praticas De las iniciativas validadas, ¿cuántas tienen alta relevancia estratégica?
Si contestó “1 o más iniciativas” en la pregunta N. De las iniciativas validadas, ¿cuántas tienen alta relevancia estratégica?
Si contestó “1 o más iniciativas” en la pregunta N.",40,14.0,Resultado da iniciativa,20A,Resposta númerica. Levantamento administrativo.,,
chile,2025,II,praticas_e_processos,Atividade e praticas,"Em relação às iniciativas reportadas, quais dos seguintes enfoques ou metodologias foram utilizados para seu desenvolvimento?","Em relação às iniciativas reportadas, quais dos seguintes enfoques ou metodologias foram utilizados para seu desenvolvimento?",4,Questão,"Atividade e praticas Em relação às iniciativas reportadas, quais dos seguintes enfoques ou metodologias foram utilizados para seu desenvolvimento? Em relação às iniciativas reportadas, quais dos seguintes enfoques ou metodologias foram utilizados para seu desenvolvimento?",40,14.0,Uso de abordagens ou metodologias de inovação,21,"A. Design thinking. B. Metodologias ágeis (Scrum, Kanban, Lean etc.). C. Pensamento sistêmico. D. Pensamento Inventivo Sistemático. E. Prospectiva estratégica ou inovação antecipatória. F. Gestão da mudança (Change Management). G. Outra. Qual? F. Nenhuma. Marque todas as opções correspondentes. Se respondeu “Nenhuma” na pergunta 19, deve marcar a opção “F. Nenhuma”.",0,
chile,2025,II,praticas_e_processos,Atividade e praticas,"Durante o período medido, quantas pessoas da instituição participaram ativamente da Rede de Inovadores Públicos?","Durante o período medido, quantas pessoas da instituição participaram ativamente da Rede de Inovadores Públicos?",4,Questão,"Atividade e praticas Durante o período medido, quantas pessoas da instituição participaram ativamente da Rede de Inovadores Públicos? Durante o período medido, quantas pessoas da instituição participaram ativamente da Rede de Inovadores Públicos?",40,14.0,Parcitapação em rede de inovação - Red de Innovadores Públicos,21A,Valor (cálculo da taxa: pessoas ativas na Rede / quantidade de pessoas na Rede). Segue o cálculo de uma variável contínua.,1,
chile,2025,II,praticas_e_processos,Atividade e praticas,"Durante o período medido, quais dos seguintes tipos de análise foram considerados nos procedimentos de identificação de necessidades ou expectativas das pessoas?","Durante o período medido, quais dos seguintes tipos de análise foram considerados nos procedimentos de identificação de necessidades ou expectativas das pessoas?",4,Questão,"Atividade e praticas Durante o período medido, quais dos seguintes tipos de análise foram considerados nos procedimentos de identificação de necessidades ou expectativas das pessoas? Durante o período medido, quais dos seguintes tipos de análise foram considerados nos procedimentos de identificação de necessidades ou expectativas das pessoas?",40,14.0,Parcitapação em rede de inovação - Red de Innovadores Públicos,22,"Marque todas las que correspondan.
A. Laboratorios o Centros de Innovación.
B. Hackatones, datatones o ideatones.
22 0
C. Concursos o comunidades de innovación abierta.
D. Eventos de generación de redes (networking) o reuniones de intereses
(meetups).
E. Otra. Espeficique:
F. Ninguna de las anteriores.
Si marca esta, no es posible señalar las demás.",0,
chile,2025,II,praticas_e_processos,Procedimentos,"Durante el periodo medido, ¿existieron procedimientos para la identificación de las necesidades o expectativas de las personas usuarias/beneficiarias?","Durante el periodo medido, ¿existieron procedimientos para la identificación de las necesidades o expectativas de las personas usuarias/beneficiarias?",4,Questão,"Procedimentos Durante el periodo medido, ¿existieron procedimientos para la identificación de las necesidades o expectativas de las personas usuarias/beneficiarias? Durante el periodo medido, ¿existieron procedimientos para la identificación de las necesidades o expectativas de las personas usuarias/beneficiarias?",40,7.0,Procedimentos para a identificação de necessidades de pessoas ou instituições usuárias,23,Resposta única. A. Sim; B. Não (Ir para a questão 24),1,sim: 0.1; não 0
chile,2025,II,praticas_e_processos,Procedimentos,"Durante o período analisado, quais dos seguintes tipos de análise foram considerados nos procedimentos para identificar as necessidades ou expectativas das pessoas? - Si respondeu a pregunta anterior.","Durante o período analisado, quais dos seguintes tipos de análise foram considerados nos procedimentos para identificar as necessidades ou expectativas das pessoas? - Si respondeu a pregunta anterior.",4,Questão,"Procedimentos Durante o período analisado, quais dos seguintes tipos de análise foram considerados nos procedimentos para identificar as necessidades ou expectativas das pessoas? - Si respondeu a pregunta anterior. Durante o período analisado, quais dos seguintes tipos de análise foram considerados nos procedimentos para identificar as necessidades ou expectativas das pessoas? - Si respondeu a pregunta anterior.",40,7.0,Procedimentos para a identificação de necessidades de pessoas ou instituições usuárias,23.1,"marque todas as opções correspondentes. A. Análises qualitativas (oficinas, focus groups, entrevistas, etnografia). B. Análises quantitativas (pesquisas telefônicas, presenciais, on-line ou em papel). C. Análises de registros administrativos (bases de dados próprias). D. Análises com dados massivos (redes sociais, navegação web, mineração de texto). E. Análises documentais ou de fontes espontâneas (revisão de OIRS, meios, atas, relatórios etc.). F. Outra, especifique:",0.5,0.1; 0.1; 0.1; 0.1; 0.1; 0
chile,2025,II,praticas_e_processos,Procedimentos,"Durante o período analisado, a instituição realizou medições de satisfação do usuário com seus serviços?","Durante o período analisado, a instituição realizou medições de satisfação do usuário com seus serviços?",4,Questão,"Procedimentos Durante o período analisado, a instituição realizou medições de satisfação do usuário com seus serviços? Durante o período analisado, a instituição realizou medições de satisfação do usuário com seus serviços?",40,7.0,Procedimentos para a identificação de necessidades de pessoas ou instituições usuárias,24,Resposta única. A. Sim; B. Não (Ir para a questão 25),0.5,
chile,2025,II,praticas_e_processos,Procedimentos,Com que frequência essas medições foram realizadas?,Com que frequência essas medições foram realizadas?,4,Questão,Procedimentos Com que frequência essas medições foram realizadas? Com que frequência essas medições foram realizadas?,40,7.0,Procedimentos para a identificação de necessidades de pessoas ou instituições usuárias,24.1,Resposta única. A. Anualmente. B. Semestralmente. C. Mensalmente. D. Semanalmente. E. Diariamente. F. Tempo real.,0.2,0.1; 0.1; 0.2; 0.2; 0.2; 0.2
chile,2025,II,praticas_e_processos,Procedimentos,Para que a instituição utilizou a informação obtida das medições de satisfação usuária?,Para que a instituição utilizou a informação obtida das medições de satisfação usuária?,4,Questão,Procedimentos Para que a instituição utilizou a informação obtida das medições de satisfação usuária? Para que a instituição utilizou a informação obtida das medições de satisfação usuária?,40,7.0,Procedimentos para a identificação de necessidades de pessoas ou instituições usuárias,24.2,Marque todas as opções correspondentes. A. Desenho de novos serviços. B. Melhoria contínua. C. Relato para outras áreas da instituição. D. Análise de demanda. E. Outros. Especifique: F. Não se utilizou.,0,
chile,2025,II,praticas_e_processos,Procedimentos,"Durante o período analisado, a instituição possuía procedimentos estabelecidos para o desenvolvimento de protótipos?","Durante o período analisado, a instituição possuía procedimentos estabelecidos para o desenvolvimento de protótipos?",4,Questão,"Procedimentos Durante o período analisado, a instituição possuía procedimentos estabelecidos para o desenvolvimento de protótipos? Durante o período analisado, a instituição possuía procedimentos estabelecidos para o desenvolvimento de protótipos?",40,7.0,Procedimentos para desenvolvimento e teste de protótipos,25,Resposta única. A. Sim; B. Não (Ir para a questão 26),1,
chile,2025,II,praticas_e_processos,Procedimentos,"Durante o período medido, quais níveis os protótipos das iniciativas de inovação alcançaram?","Durante o período medido, quais níveis os protótipos das iniciativas de inovação alcançaram?",4,Questão,"Procedimentos Durante o período medido, quais níveis os protótipos das iniciativas de inovação alcançaram? Durante o período medido, quais níveis os protótipos das iniciativas de inovação alcançaram?",40,7.0,Procedimentos para desenvolvimento e teste de protótipos,25.1,Marque todas as opções correspondentes.  A. Protótipo conceitual. B. Protótipo sensorial. C. Protótipo funcional. D. Outro(s). Qual(is)?,0,
chile,2025,II,praticas_e_processos,Procedimentos,"Durante o período analisado, a instituição possuía procedimentos para testar seus protótipos de solução?","Durante o período analisado, a instituição possuía procedimentos para testar seus protótipos de solução?",4,Questão,"Procedimentos Durante o período analisado, a instituição possuía procedimentos para testar seus protótipos de solução? Durante o período analisado, a instituição possuía procedimentos para testar seus protótipos de solução?",40,7.0,Procedimentos para desenvolvimento e teste de protótipos,26,Resposta única. A. Sim; B. Não (Ir para a questão 27),1,
chile,2025,II,praticas_e_processos,Procedimentos,"Durante o período medido, com quais dos procedimentos a seguir para a realização de testes a instituição contava?","Durante o período medido, com quais dos procedimentos a seguir para a realização de testes a instituição contava?",4,Questão,"Procedimentos Durante o período medido, com quais dos procedimentos a seguir para a realização de testes a instituição contava? Durante o período medido, com quais dos procedimentos a seguir para a realização de testes a instituição contava?",40,7.0,Procedimentos para desenvolvimento e teste de protótipos,26.1,"Marque todas as opções correspondentes. A. Desenho de um plano de testes com objetivos, hipóteses e critérios de sucesso definidos. B. Definição de métricas e indicadores para avaliar os resultados do teste. C. Testes com usuários reais ou simulações. D. Definição de um fluxo de trabalho com papéis, prazos e responsáveis. E. Coleta sistemática de feedback de usuários ou outros atores envolvidos nos testes. F. Registro e análise dos resultados dos testes. G. Outro(s). Qual(is)? Marque todas as opções correspondentes.",0,
chile,2025,II,praticas_e_processos,Procedimentos,"Durante o período medido, a instituição possuía procedimentos vigentes para medir o desempenho de suas soluções de inovação?","Durante o período medido, a instituição possuía procedimentos vigentes para medir o desempenho de suas soluções de inovação?",4,Questão,"Procedimentos Durante o período medido, a instituição possuía procedimentos vigentes para medir o desempenho de suas soluções de inovação? Durante o período medido, a instituição possuía procedimentos vigentes para medir o desempenho de suas soluções de inovação?",40,7.0,Procedimentos para medir o desempenho da inovação,27,Resposta única. A. Sim; B. Não (Ir para a questão 28),1.6,sim: 0.16; não 0
chile,2025,II,praticas_e_processos,Procedimentos,"Durante o período medido, quais análises faziam parte dos instrumentos para avaliar suas soluções de inovação? Marque todas as opções correspondentes. Considere as análises utilizadas tanto ao avaliar soluções pilotadas quanto implementadas.","Durante o período medido, quais análises faziam parte dos instrumentos para avaliar suas soluções de inovação? Marque todas as opções correspondentes. Considere as análises utilizadas tanto ao avaliar soluções pilotadas quanto implementadas.",4,Questão,"Procedimentos Durante o período medido, quais análises faziam parte dos instrumentos para avaliar suas soluções de inovação? Marque todas as opções correspondentes. Considere as análises utilizadas tanto ao avaliar soluções pilotadas quanto implementadas. Durante o período medido, quais análises faziam parte dos instrumentos para avaliar suas soluções de inovação? Marque todas as opções correspondentes. Considere as análises utilizadas tanto ao avaliar soluções pilotadas quanto implementadas.",40,7.0,Procedimentos para medir o desempenho da inovação,27.1,"A. Avaliação de desempenho por meio de indicadores quantitativos. B. Comparação com a situação anterior (linha de base) ou com soluções alternativas. C. Análise de feedback qualitativo de pessoas usuárias ou beneficiárias. D. Identificação de riscos, barreiras ou oportunidades emergentes após o teste ou implementação. E. Avaliação do processo de implementação. F. Avaliação de impacto em resultados. G. Outro(s). Qual(is)?",1.2,"0.19
0.20
0.19
0.19
0.19
0.19
0.05"
chile,2025,II,praticas_e_processos,Processos,"Durante o período medido, a instituição contava com algum processo para inovar?","Durante o período medido, a instituição contava com algum processo para inovar?",4,Questão,"Processos Durante o período medido, a instituição contava com algum processo para inovar? Durante o período medido, a instituição contava com algum processo para inovar?",40,19.0,Desenho e fluxo de processos,28,Resposta única. A. Sim; B. Não (Ir para a questão 29),0,
chile,2025,II,praticas_e_processos,Processos,Qual foi a data da última revisão do processo de inovação? DD/MM/AA. (resposta não obrigatória),Qual foi a data da última revisão do processo de inovação? DD/MM/AA. (resposta não obrigatória),4,Questão,Processos Qual foi a data da última revisão do processo de inovação? DD/MM/AA. (resposta não obrigatória) Qual foi a data da última revisão do processo de inovação? DD/MM/AA. (resposta não obrigatória),40,19.0,Desenho e fluxo de processos,28.1,"Se você respondeu “Apenas avaliado” ou “Sim, avaliado e redesenhado” à pergunta anterior.

DD/MM/AA. (opcional)",0,
